{
  "counts": {
    "conflicts_open": 0,
    "fee_versions": 2,
    "human_review_open": 10,
    "jurisdiction_rules": 0,
    "policies": 0,
    "portals": 2,
    "routes": 4,
    "source_evidence": 4,
    "source_evidence_verified": 3,
    "visa_centers": 0
  },
  "generated_from": "unknown",
  "matrix": {
    "created_entries": 0,
    "dispositions": {},
    "excluded_entries": 0,
    "exclusion_rules": [
      "destination == holder's own state -> explicit NOT_APPLICABLE row (never omitted)",
      "non-ordinary travel documents grouped as nationality=ANY per destination/category (documented normalization, refined by research)",
      "residence normalized to ANY at matrix level; residence-specific overrides added when research shows a residence-dependent disposition"
    ],
    "expected_entries": 318222
  },
  "metrics": {
    "APPLICANT_HANDOFF_COVERAGE": 0.0,
    "FEE_VERIFIED_COVERAGE": 0.0,
    "MATRIX_COMPLETENESS": 0.0,
    "PREPARATION_COVERAGE": 0.0,
    "PRODUCTION_ADAPTER_COVERAGE": 0.0,
    "REQUIREMENTS_VERIFIED_COVERAGE": 0.0,
    "SOURCE_COVERAGE": 0.012048
  },
  "notes": "Matrix completeness is structural only; verified coverage is measured separately and is the honest service-level signal.",
  "snapshot_date": "2026-07-23"
}
